<?xml version="1.0"?>
<acc:access authSystem="knb" order="allowFirst"
    id="brooke.124.1" scope="document"
    xmlns:acc="eml://ecoinformatics.org/access-2.2.0"
    xmlns:xsi="http://www.w3.org/2001/XMLSchema-instance"
    xsi:schemaLocation="eml://ecoinformatics.org/access-2.2.0 xsd/eml-access.xsd">
    <allow>
      <principal>uid=brooke,o=NCEAS,dc=ecoinformatics,dc=org</principal>
      <permission>all</permission>
    </allow>
    <allow>
      <principal>public</principal>
      <permission>read</permission>
    </allow>
    <deny>
      <principal>uid=berkley,o=NCEAS,dc=ecoinformatics,dc=org</principal>
      <permission>read</permission>
      <permission>write</permission>
      <permission>all</permission>
    </deny>
</acc:access>
